body,title
"La angustia por la depresión y por el irrefrenable deterioro ambiental llevaron a un arquitecto a transformar un tiradero de basura en un edén. Las formas geométricas, los colores, la variedad de plantas y cactáceas, el diseño y la decoración forman en conjunto un paraíso.
Vives Verde es el proyecto que hace ocho años emprendió Francisco Martínez en un predio particular de mil 600 metros cuadrados, en la calle Tula de la colonia Las Culturas de Xoxocotlán, municipio conurbado a la capital por la zona suroeste.
Ese espacio cuenta con al menos 200 especies de plantas, en su mayoría endémicas, que prácticamente no requieren de un riego manual, pero si fuera el caso, también el área tiene una cisterna con capacidad de 80 mil litros de agua captada de cada temporada pluvial.
El lugar está diseñado de manera estratégica y con formas geométricas prehispánicas; se asienta a las faldas del cerro de la zona arqueológica de Monte Albán, por el lado sur.
Senderos rectos o serpenteados cubiertos con piedra de río, sellado con tierras de colores, particularmente de color  verde turquesa.

Cada espacio tiene elementos que complementan el paisaje, como ojos de agua redondos o rectangulares con plantas acuáticas, piezas viejas de metate, cuencos de piedra o de cerámica con agua entintada, en su mayoría de rojo.
Ruedas de bicicletas u otros vehículos; una carreta vieja, sillas igualmente antiguas, metálicas, con sarro algunas; bancos de madera o de troncos; piezas de barro de regular tamaño y algunos colgajos elaborados con alambre.
La barda de acceso es de carrizo y de órganos, las paredes que circundan los espacios están cubiertas con bardas de carrizo, en algunos casos de unos 10 metros de altura, a fin de no perturbar la imagen armónica del jardín particular.
El pasado 17 de noviembre abrió sus puertas al público en general, que puede acudir a visitarlo e incluso pasar tiempo para relajarse, sin ningún costo; está disponible también para grupos de estudiantes de cualquier nivel educativo.
La génesis
De acuerdo con su creador, Vives Verde es un proyecto preocupado por conservar plantas nativas de las diferentes regiones del estado de Oaxaca, mezclándose con antigüedades, para diseñar espacios de arquitectura de paisaje con identidad,  y  poder disfrutar de la naturaleza, creando proyectos sustentables con especies de bajo mantenimiento.

Este gusto por diseñar espacios abiertos en arquitectura de paisaje proviene de la experiencia que el arquitecto Francisco Martínez desarrolló a lo largo de 18 años de trabajo profesional en el Jardín Etnobotánico de la ciudad de Oaxaca.
“Lo inicié con mi familia, para ellos, para relajarnos de la vida cotidiana, de tanto estrés, pero ha crecido mucho. Ahora podemos ofrecerlo al público, hay mucha demanda, la gente  se identifica con tener una planta”, explica a EL UNIVERSAL.
“En 2010 comencé con la idea de contribuir con el cuidado del plantea, pero lo inicié porque me empezaba a preparar por si un día tenía depresión; la familia sufre de este mal. Y sí me alcanzó en 2015, afortunadamente el jardín  ya tenía   un 70%; eso fue parte para relajarme, escuchar aves, disfrutar el paisaje; ahí vamos, ha servido, vamos saliendo de la depresión”, platica.
Por casi dos décadas, Francisco laboró para el Jardín Etnobotánico de la capital, proyecto iniciado por el artista plástico Francisco Toledo.
Ahí aportó Francisco su experiencia como profesionista y apasionado de la arquitectura de paisaje; de ahí le nació el gusto también por las formas, colores y el cuidado del medio ambiente. De ahí partió la idea de su propio jardín.

Lo antiguo
“Siempre me ha llamado la atención la arquitectura de la época prehispánica, desde pequeño; mi papá fue carpintero, a los 10 años me ponía a armar grecas”, narra el egresado de la Universidad Autónoma Benito Juárez de Oaxaca (UABJO).
Abregó también conocimientos de visitas a otros espacios prehispánicos del país, como Teotihuacan, Chichen Itzá, Palenque, entre otros. A la par de sus viajes, fue trayendo algunas especies de plantas de entidades como Puebla, Morelos, Querétero, entre otros.
“Estamos en las faldas del cerro de Monte Albán, de la zona arqueológica, y eso, de alguna manera, nos da también energía para seguir impulsando el proyecto. Queremos que los seres humanos entendamos que debemos cuidar nuestro entorno, por ahí podemos empezar, desde recoger basura, reutilizar agua, cuidar las plantas, por muy sencillas que fuesen; si no, podríamos arrepentirnos en corto tiempo”, considera.
El padre de familia de dos adultos, una de ellas ya en carrera profesional, detalla que paralelo al jardín paisajista, comenzó con su familia el rescate de un afluente que corre a un costado del predio.
Actualmente, son 300 metros lineales que ya han sido rescatados, con la limpieza de basura, pero además con la siembra de árboles y plantas propias de la zona.

En el caso del jardín particular, desde hace ocho años comenzaron por retirar la basura en los predios y, a la par, comprar poco a poco otros lotes, hasta formar los mil 600 metros cuadrados.
En la zona del arroyo de temporal sembraron especies como ceibas, robles, las tres variedades de tabebuia, retama, trovadoras, palo verde, entre otras, que no requieren de grandes cantidades de agua.
En el jardín, paulatinamente  se fue llenando con especies semitropicales: retamas, variedades de copal, flor de mayo, yuca, agaves, biznagas, diones, entre otros.
“Cubrimos todos los requisitos y autorizaciones; las plantas tienen el registro de la Unidad de Manejo Ambiental [UMA] que pide la Semarnat [Secretaría de Medio Ambiente y Recursos Naturales]”, precisa.
Para aprendizaje
A poco menos de 15 días de haber sido abierto, ya es visitado continuamente tanto por particulares como grupos escolares de todos los niveles educativos, públicos y privados, incluyendo del nivel profesional.

Inicialmente, Francisco Martínez tenía previsto abrir el espacio de nueve de la mañana a cinco de la tarde de lunes a viernes, los sábados de nueve a cuatro. Pero la demanda hizo que el horario se ampliara todos los días.
Dos trabajadores están al pendiente de regar las áreas necesarias para que el paisaje mantenga los colores tanto de los pasillos como de los recipientes con agua, donde se colocan distintas tonalidades.
“Lo que quiero es que las nuevas generaciones tomen conciencia, que los niños aprendan que deben reutilizar el agua de lluvia o de la casa, que cuando construyan sus casas deben tener cisternas para almacenar”, expone.
“La naturaleza ha dado mucho para la cultura de Oaxaca, por eso nos voltean a ver, por eso quieren venir a Oaxaca, porque es la cultura del mundo. Todos, adultos y niños, debemos tener conciencia ya de la importancia de cuidar las plantas, de plantar más árboles, de protegerlos, de cuidarlos, porque no sabemos cuándo el cambio climático nos alcanzará a todos”, reflexiona.
El proyecto de Vives Verde continúa y la siguiente fase será colocar pequeñas placas a cada una de las especies, con nombres en español y su identificación científica, para que sea un aprendizaje integral para los educandos.
 
","Edén botánico, de basurero a proyecto sustentable"
"El actor Fernando Luján falleció esta tarde a los 79 años en su casa de Puerto Escondido, Oaxaca, confirrmó TV Azteca. La Asociación Nacional de Actores evalúa junto con la familia si el cuerpo del intérprete se trasladará a la Ciudad de México para ser velado.
Hace poco más de un año la salud de Luján se vio comprometida debido a que fue diagnosticado con neumonía, falla cardiaca, desnutrición y enfermedad pulmonar obstructiva crónica (EPOC), que padeció por fumar durante más de 60 años.
De acuerdo con Juan Carlos Vázquez García, especialista en neumología y director de enseñanza del Instituto Nacional de Enfermedades Respiratorias (INER), la EPOC suele presentarse con mayor frecuencia en personas de más de 40 años, especialmente en aquellas que estuvieron expuestas a humo de cigarro y leña, así como a contaminación atmosférica.
Señala que algunos de los primeros síntomas que manifiesta esta enfermedad son falta de aire de forma crónica y progresiva de lenta evolución, opresión en el pecho y tos constante.
La EPOC, sin embargo, es considerada una enfermedad sistémica, debido a la pérdida de masa corporal que sufren las personas con este padecimiento. Incluso, la desnutrición y obesidad, presentes cuando ésta se encuentra en un estado avanzado, son parte de las características de esta patología.
“Ahorita estoy recuperándome porque estuvo muy pesado el fin de año, hace dos meses me vinieron varias cosas juntas muy pesadas, me vino EPOC, neumonía y desnutrición”, dijo el actor a El Universal.
Vázquez García asegura que la EPOC es la principal causa de muerte por enfermedad respiratoria y la cuarta por enfermedad general, sólo después de los padecimientos cardiovasculares, diabetes y cáncer.
En tanto, en México y en el mundo más del 80% de los pacientes con EPOC aún no están diagnosticados. Mientras que hasta el 25% de ellos con enfermedad avanzada siguen sin conseguir un diagnóstico que les permita obtener tratamiento, indica el médico.
“Hay un gran subdiagnóstico de la enfermedad, hay muchas personas en riesgo de padecerla”, afirma. Este riesgo es aún mayor en personas que han fumado más del equivalente a una cajetilla de cigarros diario durante 10 años"", señala.
Hace dos semanas, su esposa Martha Mariana dijo a Pati Chapoy que fueron a Puerto Escondido de vacaciones porque el médico se los autorizó, pero fue allá donde el actor se empezó a sentir mal por la altura e inmediatamente lo llevaron al médico.
 
",
"
Sin duda, uno de los autos más esperados para la edición 2019 del Detroit Auto Show es el nuevo Toyota Supra. Este deportivo japonés estaba siendo ocultado para hacer su gran revelación durante la expo de autos, sin embargo una cuenta de Twitter de Toyota publicó por accidente como se ve este deseado auto. 
Las imágenes fueron retiradas casi instantáneamente pero estuvieron el tiempo suficiente para ver el diseño completo del auto sin camuflaje. Y para que el sitio de fanáticos Supra MkV lograra subir una versión con más calidad del video.

El auto consigue destacar ante cualquier deportivo que hayas visto antes, incluso logra distinguirse de su hermano de plataforma, el BMW Z4. Las imágenes no muestran detalles de los interiores así que habrá que esperar una semana más para eso o a que Toyota lance imágenes oficiales del nuevo Supra 2020 e, igualmente, habrá que ser pacientes para conocer sus detalles de motorización. 
 



Artículo


Volkswagen presenta nuevo avance de Passat 2020 

Autopistas


El sedán hará su debut mundial la próxima semana en el Auto Show de Detroit 2019 







",Nuevo Toyota Supra revelado por accidente 
"
El 5 de mayo de 2017 EL UNIVERSAL informó que las ganancias en el robo de hidrocarburos a Petróleos Mexicanos (Pemex), son amplias, de ahí la disputa.
Según el reporte de las autoridades estatales, de enero al 4 de noviembre de 2017 se decomisaron 4 millones 403 mil 116 litros de hidrocarburo; de haberse vendido en el mercado negro —a los 9 pesos el litro en que se ofrece— las organizaciones criminales habrían obtenido una ganancia de 39 millones 628 mil pesos en esos primeros 10 meses del año.

En ese periodo, se indicó, las autoridades encargadas de combatir a los huachicoleros aseguraron 788 tomas clandestinas en el ""Triángulo Rojo"", 2 mil 351 vehículos y detuvieron a 694 personas.
El Triángulo Rojo, de acuerdo con las autoridades, está conformado por las localidades de Acajete, Tepeaca, Acatzingo, Quecholac, Tecamachalco y Palmar del Bravo. Sin embargo cifras oficiales de seguridad en la entidad indicaron que ese problema se extiende a los municipios de Puebla capital, San Martín Texmelucan, Atzinzintla, Esperanza y Amozoc.
Lee más: Huachicoleros desencadenan violencia en ""Triángulo Rojo""
Los vehículos preferidos por los huachicoleros para el robo de combustible
El 19 de mayo de 2017, EL UNIVERSAL dio a conocer sobre el Corralón del Huachicol, el cual operaba la Procuraduría General de la República (PGR) en el sur de la capital poblana. Según datos proporcionados por las autoridades estatales, en total sumaban en ese momento mil 228 vehículos recuperados con reporte de robo, todos ligados con la extracción de combustible en los ductos de Pemex.
Según la información de inteligencia, las organizaciones como la de Antonio Martínez “El Toñín” y la de Roberto de los Santos de Jesús “El Bukanas”, operan con un grupo de personas que se dedican específicamente al robo de automotores, en particular, en las carreteras que confluyen en los seis municipios que conforman el denominado Triángulo Rojo.
Se destacó que los “chupaductos” utilizan con frecuencia las camionetas Pick up a las que instalan redilas. También Suburban, Silverado y Custom que aparecieron en el mercado entre los años 1995 y 2010.
Se informó que cada uno de estos vehículos que encontraron las autoridades, según las adaptaciones realizadas a los mismos, permiten subir bidones de gasolina que en promedio pueden llevar entre 500 y mil 500 litros de gasolina.
De la marca General Motors se seleccionan el modelo S10 y de la marca Ford los modelos de camionetas F-600 y F-150, a las que pueden o no adaptar redilas. Lo mismo sucede con la marca Dodge, la versión RAM.
También que los modelos Voyager, Econoline y Ecosport (por ser camionetas cerradas), son usadas para llevar bidones de 50 litros con la intención de pasar inadvertidos ante las autoridades. De la marca Nissan, la camioneta Estaquitas ha sido utilizada con el mismo fin. El caso del coche Tsuru es el mismo que el Chevy.
De la marca Volkswagen también se utilizan automóviles como Beetle, Pointer, Bora, Passat y Jetta. Los Pontiac también han sido robados y algunos de ellos recuperados.
Ante la necesidad de mover cantidades mayores de gasolina, los grupos delictivos recurren al hurto de vehículos más grandes como camiones de pasajeros y microbuses con los que trasladan en un solo viaje de siete mil a 27 mil litros de combustible.
Se incluye también el robo de camiones de carga pesada y/o ligera (de 3.5 a 10 toneladas) como por ejemplo los tractocamiones con remolque, pipas de agua, torton, camiones de volteo marca Kenworth e Isuzu modelo Elf 200.
Lee más: El corralón del huachicol

Clausuraron siete gasolineras por venta de huachicol
El 1 de junio de 2017, Pemex confirmó la rescisión de contrato a 7 gasolineras en zona de huachicol, ubicadas en los municipios de Palmar de Bravo, Cuyoaco, Tecamachalco, Huixcolotla y Quecholac, en Puebla.
Puebla, primer lugar en decomisos de combustible robado
El 12 de junio del mismo año se informó que Puebla ocupaba el primer lugar a nivel nacional en decomisos de combustible robado.
La instancia de seguridad indicó que con base en datos de Pemex y la PGR, el total de decomisos en el año ascendió a 2 millones 649 mil 967 litros.
Un comunicado del Grupo de Coordinación Puebla Segura resaltó que dicho aseguramiento representaría llenar el tanque de 66 mil 248 vehículos con capacidad de 40 litros.


","Puebla, el epicentro del huachicol"
"Según los científicos de la Administración de Alimentos y Medicamentos de Estados Unidos (FDA, por sus siglas en inglés), la cafeína puede ser parte de una dieta saludable para la mayoría de las personas, pero demasiada puede representar un peligro para la salud.
Dependiendo de factores como el peso corporal, los medicamentos que se ingieran y la sensibilidad de cada persona a la cafeína, la noción de 'demasiada' puede ser muy diferente.
¿Tomas sólo una taza de café o té a primera hora de la mañana para activarte? ¿Después una bebida con cafeína o dos y luego varias tazas de café durante el día? Entonces, los consejos de estos expertos estadounidenses te interesan.
1. ¿Cómo sé cuánta cafeína contiene un alimento o bebida?
Muchos alimentos envasados, incluidas bebidas y suplementos dietéticos, proporcionan voluntariamente información en la etiqueta sobre la cantidad de cafeína que contienen. Los consumidores deben tener cuidado al ingerir por primera vez un nuevo alimento envasado que contenga cafeína si la cantidad no está declarada en la etiqueta, advierte la FDA.
Hay varias bases de datos accesibles a través de internet que proporcionan estimaciones del contenido de cafeína de ciertos alimentos y bebidas como el café y el té. Sin embargo, la cantidad en estas bebidas elaboradas puede variar dependiendo de factores como dónde se cultivaron y procesaron los granos de café y las hojas de té, y cómo se prepara el producto.
Como referencia, una lata de 1/3 de litro de un refresco con cafeína suele contener de 30 a 40 miligramos de cafeína, una taza similar de té verde o negro de 30 a 50 miligramos, y una taza de café más cerca de 80 a 100 miligramos. La cafeína en las bebidas energéticas puede variar de 40 a 250 miligramos por cada tercio de litro.

2. Si un café o té dice 'descafeinado', ¿significa que no contiene cafeína?
No. Los cafés y tés descafeinados tienen menos cafeína que sus contrapartes normales, pero aún contienen algo. Por ejemplo, el café descafeinado generalmente tiene dos a 15 miligramos en una taza de 1/3 de litro. Si reaccionas a la cafeína de manera negativa, deberías evitar estas bebidas por completo, recomiendan los científicos.
3. ¿Cuánta cafeína es demasiada?
Para los adultos sanos, la FDA ha citado 400 miligramos al día, es decir, alrededor de cuatro o cinco tazas de café, como una cantidad que generalmente no se asocia con efectos negativos peligrosos. Sin embargo, advierten de que existe una gran variación tanto en la sensibilidad de las personas a los efectos de la cafeína como en la rapidez con la que la metabolizan.
Ciertas condiciones tienden a hacer que las personas sean más sensibles a los efectos de la cafeína, al igual que algunos medicamentos. Además, si se está embarazada, intentando quedarse en estado, amamantando o si le preocupa otra enfermedad o medicamento, recomiendan que se consulte al médico si es necesario limitar el consumo de cafeína.
La FDA no ha establecido un nivel para los niños, pero la Academia Estadounidense de Pediatría desalienta el consumo de cafeína y otros estimulantes en niños y adolescentes.


4. ¿La cafeína es un peligro para la salud?
La agencia reguladora estadounidense estima que se pueden observar efectos tóxicos, como convulsiones, con un consumo rápido de alrededor de mil 200 miligramos de cafeína, o 0,15 cucharadas de cafeína pura.
Los productos de cafeína puros y altamente concentrados representan ""una amenaza importante"" para la salud pública, alertan. Estos productos, a menudo etiquetados como suplementos dietéticos, consisten en cafeína pura o altamente concentrada en forma líquida o en polvo, y se comercializan en paquetes a granel con hasta miles de porciones por envase, lo que requiere que el consumidor mida una porción segura de lo que puede ser una cantidad tóxica o ""incluso letal"".
El riesgo de una sobredosis por cafeína crece a medida que aumenta la concentración de cafeína en el producto, lo que significa que incluso pequeñas dosis de un producto altamente concentrado podrían provocar efectos peligrosos.
Sólo una cucharadita de cafeína en polvo puro puede contener la misma cantidad de cafeína que 28 tazas de café, y media taza de un producto líquido de cafeína altamente concentrada contiene el equivalente a más de 20 tazas de café. Estas son cantidades tóxicas que pueden tener consecuencias graves para la salud, incluida la muerte.

5. ¿Cómo puedo reducir su consumo?
Si estás acostumbrado a tomar bebidas que contienen cafeína todos los días y deseas reducir su consumo, lo mejor es hacerlo gradualmente. Detener la ingesta repentinamente puede causar síntomas de abstinencia como dolores de cabeza, ansiedad y nerviosismo, recuerdan desde la FDA.
A diferencia de la abstinencia de opioides o alcohol, la de cafeína no se considera peligrosa, pero puede ser desagradable.

 
",
"
Ante el desabasto de gasolina que se vive en varios estados del país, en redes sociales volvió a circular un video en el que se muestra cómo los habitantes de Calpulalpan, Tlaxcala, extraen con cubetas el diésel acumulado en un canal de este municipio.
Este conducto se nutre de fugas causadas por tomas ilegales de ductos de Petróleos Mexicanos (Pemex), las cuales fueron ocasionadas desde diciembre de 2015.
En la grabación se aprecia cómo varios habitantes caminan hasta la orilla del canal para sustraer con la ayuda de cubetas el combustible. Incluso, personas desde la parte superior del lugar amarran lazos en sus cubetas para ayudarse a extraer el diésel.
A pesar de que este video tiene tres años de su difusión, los cibernautas especifican que en dicho lugar “fluye gasolina libremente” y, argumentan, que las anteriores administraciones permitieron este robo.
 

Los habitantes de Calpulalpan, Tlaxcala, ordeñan libremente un canal con diésel :( pic.twitter.com/UuBzMbH6kQ
 — citlalli (@Citlalli_ev) 11 de enero de 2019

cev
","""Reviven"" video en el que habitantes de Calpulalpan ordeñan un canal con diésel "
