body,title
"
El actor Fernando Luján, quien falleció a los 79 años este viernes en su casa de Puerto Escondido, Oaxaca, deja un gran legado en la industria cinematográfica y en la televisión de México, ya que tuvo participación en 27 melodramas y un gran número de largometrajes.
Fernando Ciangherotti Díaz, su nombre real, quien había sido internado recientemente por un cuadro de EPOC (Enfermedad Pulmonar Obstructiva Crónica), nació el 23 de agosto de 1938 en Bogotá, Colombia, debido a que su padre se encontraba en una gira teatral en ese momento.
Es hijo de dos destacados actores, Mercedes Díaz, de la dinastía de los hermanos Soler, y Alejandro Ciangherotti; recientemente se le vio en la pantalla grande en las películas “Cuando los hijos regresan” y en “¡Hombre al agua!”.
Destacó por su participación en la Época de Oro del cine mexicano; inició su carrera como actor infantil a la edad de ocho años con la película ""La cobarde"" (1947).
En 1952 debutó en el filme ""La segunda mujer"", con el nombre de Fernando Ciangherotti, pero tiempo después lo cambió por Fernando Luján.
Cuatro años más tarde se casó por primera vez con Laura, la madre de su primer hijo, el también actor Fernando Ciangherotti; tuvo nueve hijos más producto de diversos matrimonios, entre ellos con la actriz Martha Mariana Castro, con quien tuvo a Paolo.
Se destacó por sus personajes cómicos en películas como ""¿Qué haremos con papá?"" (1965), por la que un año después recibió una Diosa de Plata por Mejor Coactuación Masculina.
En 1969 comenzó su carrera como director de teatro con la obra ""Cuando las chicas no quieren"", de Reich. Al siguiente año montó ""Cuatro y Ernesto"", de Alfonso Paso, y en 1976 dirigió ""Un tirador franco"", de Velker.
En la televisión incursionó en la comedia, como actor del programa ""Domingos Herdez"" (1970), en el que realizó un personaje llamado ""Don Cucufato"".
En 1993 participó en la realización del guión de la película ""Dólar mambo"", realizada por Paul Leduc.
En el ámbito televisivo, Luján ha trabajado en diversos programas y telenovelas, de las cuales destacan ""Cadenas de amargura"" (1991), ""Sueño de amor"" (1993), ""Para toda la vida"" (1996) y ""Mirada de mujer"", con la que obtuvo gran reconocimiento.

Las películas que marcaron el rumbo de su carrera en el cine juvenil fueron ""El mil amores"" (1954), de Rogelio A. González; ""La edad de la tentación"" (1958), de Alejandro Galindo; ""Peligros de juventud"" (1959), de Benito Alazraki; y ""El pueblo fantasma"" (1963), dirigida por Alberto B. Crevenna.
También intervino en los filmes ""El coronel no tiene quien le escriba"" (1999), ""En el país de no pasa nada"" (2000), ""El Tigre de Santa Julia"" (2002), ""Tú te lo pierdes"" (2005), ""El Carnaval de Sodoma"" (2006), ""Labios rojos"" (2008) y ""Huevos revueltos"" (2009).
En 2010 participó en la telenovela ""Entre el amor y el deseo"", en la que dio vida a ""Édgar Dumont"", un hombre millonario.
Su actuación más reciente fue en el melodrama ""Quererte así"" (2012), la cual fue producida por Rafael Urióstegui.
En septiembre del mismo año inició de nuevo grabaciones de la telenovela ""Los Rey"", en la cual dio vida al patriarca ""Everardo Rey"", un hombre ambicioso que no se detiene con nada para obtener más poder.
En 2013 el actor recibió un homenaje durante el Festival Internacional de Cine de Guanajuato (GIFF). Fue reconocido con la Cruz de Plata de este encuentro, bajo el lema de ""Más Cine por Favor"" y recibió dos premios más por parte de la Universidad Nacional Autónoma de México (UNAM), que le entregó la Medalla de Plata de la Filmoteca de esta casa de estudios.
Además, la presidencia municipal de San Miguel de Allende le otorgó, a través de un corazón de latón de San Miguel, por haber hecho latir a millones de personas con sus películas y a este lugar con su presencia.
En 2014 participó en la película de comedia “Cásese quien pueda”, al lado de actores como Martha Higareda y Luis Gerardo Méndez; En 2017 fue parte del elenco de la serie de Netflix “Ingobernable” y en la cinta “Cuando los hijos regresan”.
Un año después participa en “¡Hombre al agua!”, protagonizada por Eugenio Derbez, además recibió un homenaje en la cuarta edición del Festival Internacional de Cine de León, Guanajuato, que se llevó a cabo del 9 al 15 de noviembre.
Asimismo, ese año, fue distinguido con el Premio Luis Buñuel, junto a la actriz española Victoria Abril, por su aportación a la industria fílmica de Iberoamérica; la entrega fue realizada en la Embajada de España en México, previo al inicio de las actividades de la sexta Muestra de Cine Español e Iberoamericano.
rad 
","Fernando Luján, toda una vida entregada a la actuación "
"
[email protected]

Toluca, Méx.— El gobernador mexiquense, Alfredo del Mazo Maza, informó este jueves, a través de un mensaje en su cuenta de Twitter, sobre el fallecimiento de su padre, el ex gobernador del Estado de México, Alfredo del Mazo González.

A su pena se unieron diversas voces de la política, como el ex presidente Enrique Peña Nieto y el actual jefe del Ejecutivo federal, Andrés Manuel López Obrador.

Ayer, Del Mazo Maza tenía previsto encabezar un evento junto al presidente López Obrador, en el municipio de Tlalnepantla, por lo que tras recibirlo, se disculpó para acudir al lado de su familia. A las 12:00 horas hizo público el anuncio del deceso.

El presidente López Obrador pidió a los asistentes al evento para presentar el programa Jóvenes Construyendo el Futuro, organizado en la Plaza Cívica Gustavo Baz, que se pusieran de pie y guardaran un minuto de silencio por la muerte de Del Mazo González.

En redes sociales se expresó la solidaridad para el mandatario mexiquense. El ex presidente Peña Nieto escribió en Twitter: “Lamento profundamente el deceso de Don Alfredo del Mazo González, hombre de larga trayectoria en el servicio público y un gran amigo. Mi más sentido pésame a su esposa e hijos. Descanse en paz”.

A los mensajes en las redes se sumaron la presidenta nacional del PRI, Claudia Ruiz Massieu, quien envió un abrazo solidario y calificó como “mi querido amigo” a Del Mazo Maza. También el secretario de Desarrollo Urbano y Metropolitano del Estado de México, Enrique Jacob Rocha, escribió: “Don Alfredo del Mazo fue un gobernador que modernizó las instituciones del gobierno del Estado de México. Descanse en paz!”. El ex secretario de Gobernación, Alfonso Navarrete, publicó sus condolencias para el actual mandatario.

A la solidaridad expresada para el gobernador Del Mazo Maza se sumaron Graco Ramírez, ex gobernador de Morelos; los diputados mexiquenses Abril Trujillo y Roberto Sánchez Campos, del grupo parlamentario del PRI en el Estado de México, y Miguel Sámano Peralta, entre otros.

También fueron publicadas condolencias de organizaciones civiles, ciudadanos de diversas entidades y los secretarios estatales, de Medio Ambiente, Jorge Rescala Pérez; de Desarrollo Social, Eric Sevilla, y el fiscal de Justicia, Alejandro Gómez Sánchez, además de alcaldes mexiquenses.

Roberto Campa, ex secretario del Trabajo, y el diputado Héctor Yunes, manifestaron su pena por la muerte de Alfredo del Mazo, quien padecía de una enfermedad pulmonar.
",Fallece ex gobernador Alfredo del Mazo 
"Por Andrea Ahedo
Faustino apenas iba a desayunar, pedaleaba con su mandado en las calles de la colonia Granjas Navidad, en Cuajimalpa, cuando fue atropellado por un camión torton blanco.
Quienes vieron el accidente, a las 07:00 horas, dijeron que en la esquina de avenida Noche de Paz y Huizachito, el chofer del vehículo de carga tocó el claxon para alertar al ciclista, de 48 años, pero una vez que lo impactó ni siquiera detuvo la marcha.
La bicicleta de Faustino fue arrastrada por el camión por más de 100 metros, hasta que el vehículo de dos ruedas quedó atorado a un costado de un automóvil negro, frente a una unidad habitacional. El responsable huyó.
SE ABRIÓ LA CABEZA. El cuerpo del ciclista quedó boca abajo con los brazos doblados hacia su pecho y una herida en la cabeza. Sus pocas pertenencias también quedaron cerca de él, al igual que su celular con los audífonos conectados.
Un grupo de policías de la Secretaría de Seguridad Ciudadana cerró el paso en aquella calle, lo que provocó caos vial —además conmoción en los transeúntes—, pues era justo la hora en la que entran los niños a la escuela, por ello padres de familia les tapaban los ojos a sus hijos para evitar que vieran el cadáver.
Unas señoras que permanecieron en la banqueta, mientras los peritos tomaban fotos, dijeron que no reconocían al ciclista: “No lo conocemos, no es de la zona, ni siquiera para avisarle a sus familiares…”.
SUS COMPRAS QUEDAN APLASTADAS. Pero les dio tristeza saber que el hombre ya no llegaría a desayunar, al ver que el mandado que cargaba quedó aplastado y regado sobre la calle.
“Iba de camino a desayunar, seguramente, ¿pero acaso su familia no se da cuenta que ya se tardó?”, dijo una de ellas, pues Faustino transportaba huevos y bolillos dentro de una bolsa plástica de color verde.
Una vez que los peritos de la Procuraduría de la Ciudad de México se llevaron el cuerpo del ciclista, los uniformados quitaron rápidamente el acordonamiento y dejaron que los vehículos transitaran encima del mandado.

",
"Un total de 325 policías concluyeron el Programa de Formación Inicial para Policía Preventivo y Perfil de Custodia Penitenciaría 2018, por lo que fueron reconocidos por el gobernador del estado, Francisco Domínguez Servién, quien encabezó la ceremonia de graduación.
El mandatario estatal destacó que la entidad se distingue en el escenario nacional por tener de los mejores resultados en seguridad, como es el caso de la Encuesta Nacional de Estándares y Capacitación Profesional Policial (ENECAP 2017), que recién fue publicada.
El documento indica que 87.6% de los elementos policiacos consultados dijeron haber recibido al menos un curso de formación inicial al ingresar, en el caso de la Policía Preventiva Estatal Ministerial el porcentaje subió a 91%, cuando la media nacional en esta categoría es de apenas 61%.
“Querétaro cuenta con ustedes, seguiremos con todo respaldando su labor con instituciones sólidas, con una visión sistémica de la seguridad, con mayores niveles de exigencia, pero también con un desarrollo profesional basado en los talentos de cada uno de ustedes”, dijo Domínguez Servién.
El gobernador reiteró la propuesta que llevó a los foros de consulta sobre la Guardia Nacional para que se reconozca la diferencia de las condiciones de seguridad que existen entre las entidades, se respete el federalismo, y se garantice el respeto a los derechos humanos.
“En estados como Querétaro, existen buenos policías que ofrecen su valor y arriesgan su vida por un mejor estado, por un México en paz, de legalidad, tranquilidad y estado de derecho”, indicó.



Artículo


Existe fortaleza financiera para enfrentar recortes


Política


""No está en riesgo la operación de la administración pública"": Francisco Domínguez 







Juan Marcos Granados Torres, secretario de Seguridad Ciudadana, explicó que la formación inicial es parte de los acuerdos para la profesionalización de las corporaciones a partir de su ingreso a la academia estatal, en donde todos reciben las mismas bases para incorporarse a los cuerpos municipales, del estado y penitenciario.
En esta generación se graduaron 56 integrantes de la Policía Estatal y 62 de las municipales, además, 207 elementos en activo tomaron dicha formación por no haberla recibido cuando se integraron a los cuerpos de seguridad.
En el evento se entregaron 13 patrullas con una inversión de 8.8 millones de pesos. De los vehículos entregados, se informó que seis patrullas recibió la Secretaría de Seguridad Ciudadana de Amealco de Bonfil, Jalpan de Serra, Landa de Matamoros, San Joaquín, Tolimán, Huimilpan y Colón.
En esta acción se invirtieron 8.8 millones de pesos del Fondo de Aportaciones para la Seguridad Pública (Fortaseg) correspondiente al ejercicio fiscal 2018, que entrega el gobierno federal.
 
 
bft
","""Querétaro es uno de los lugares más seguros"": FDS "
"Luego de que recrudeciera el desabasto de combustible en el estado de Guanajuato, estaciones gasolineras colindantes entre San Luis y Guanajuato registraron una venta inusual de combustible, como el caso de Villa de Reyes, municipio potosino.  
El secretario general de gobierno en San Luis Potosí, Alejandro Leal Tovías, informó que en el municipio conurbado se detectó que automovilistas guanajuatense abastecían - además de los automóviles - garrafas o bidones, por lo que el gobierno del estado implementó un operativo restrictivo y evitar la venta en dichos contenedores.
Aseguró que los vehículos que lleguen podrán cargar gasolina, sin embargo, no se permitirá la venta en bidones, además – reiteró - que está prohibido por la Coordinación Estatal de Protección Civil en San Luis  Potosí, por el riesgo que eso representa y se desconocería el destino del combustible de las garrafas”.
“Casi imposible el desabasto en SLP”
El secretario general de gobierno, Alejandro Leal aseguró a EL UNIVERSAL SAN LUIS POTOSÍ que por su ubicación logística estratégica, es “muy difícil o casi imposible” que San Luis Potosí se quede sin combustibles por temas de distribución, ya que además de la terminal de almacenamiento de Pemex, está en construcción una terminal privada que será de las más grandes del país.
Explicó que actualmente San Luis Potosí consume aproximadamente 19 mil 800 barriles de combustible diarios, divididos en 12 mil de gasolina Magna, mil 800 de Premium y 6 mil Diésel, de los cuales el 90 por ciento son abastecidos por Pemex y solo alrededor de un 10 por ciento vienen de la refinería de Exxon en Texas para las estaciones Móbil en la capital potosina.



Artículo


Garantizado abasto de combustibles en San Luis Potosí: Pemex


Cartera


La petrolera reafirmó que se mantiene el abasto normal de combustible en el estado. 






En la actualidad, Pemex cuenta con una Terminal de Almacenamiento para unos 100 mil litros de combustible, es decir “que si no se recargara habría gasolina solo para cinco días, sin embargo todos los días a través de pipas y carrotanques ferroviarios se vuelven a recargar los barriles consumidos el día anterior, por lo que siempre se tiene esta gran reserva de 5 veces el consumo diario”, indicó.
“Por otro lado está la construcción de la Terminal de Almacenamiento Watco en la zona industrial, la cual ya está recibiendo gasolina de la refinería texana de Exxon Móbil, pero que para marzo de este año en su primera etapa contará ya con una capacidad para 300 mil barriles, en su segunda etapa podrá almacenar 600 mil barriles y para su tercera etapa (y final) tendrá una capacidad para un millón 200 mil barriles, es decir que en corto tiempo San Luis Potosí tendrá una capacidad de almacenamiento de más de un millón 300 mil barriles de combustible, todos dentro de la zona conurbada de la ciudad capital.
Lo anterior significa que en caso de contingencia y que por alguna razón no existiera más producto, lo cual no es el caso en la actualidad- explica -  alcanzaría para abastecer a la entidad por más de dos meses sin necesidad de reabastecer las terminales de almacenamiento.
[email protected] 
vkc
",Detallan logística de distribución y consumo de gasolina en SLP
"
Tlalnepantla, Estado de México.- El presidente Andrés Manuel López Obrador pidió un minuto de silencio en memoria de Alfredo del Mazo González, padre del actual gobernador Alfredo del Mazo, quien falleció esta tarde.
Al arrancar el programa Jóvenes Construyendo el Futuro, López Obrador destacó que Del Mazo González fue gobernador de esa entidad.
El mandatario explicó que por esa razón el gobernador Del Mazo no pudo acompañarlo al lanzamiento de uno de sus programas considerados como prioritarios.
""Me recibió, le di un abrazo"", mencionó López Obrador, quien pidió a los asistentes guardar un minuto de silencio.
El programa otorgará 3 mil 600 pesos mensuales a jóvenes para que se capaciten en empresas y tengan una opción laboral.


jno
",AMLO pide minuto de silencio por deceso de Alfredo del Mazo González
"

Debió haber sido un inicio de sexenio de susto para Carlos Romero Deschamps. Símbolo de la corrupción priista, la llegada al poder del presidente Andrés Manuel López Obrador y su promesa de democratizar los sindicatos seguramente lo tenía bastante preocupado. Romero Deschamps ha encabezado desde tiempos de Carlos Salinas de Gortari, y gracias a él, el poderoso sindicato petrolero.

Pero bien dicen que las penas con pan son menos. Y si algo no va a faltar a la mesa de ese sindicato es pan: Carlos Romero Deschamps y su incondicional Ricardo Aldana, varias veces legisladores del PRI, controlan a través del sindicato el jugoso negocio de las pipas de Pemex. Esas que son blancas, grandotas, con el logotipo de Pemex, todas esas son del sindicato. Y con la decisión del presidente AMLO de cerrar los ductos, cuando circulan por las calles las pipas levantan más miradas y suspiros que un(a) modelo con ropa entallada.

Las pipas están más demandadas que nunca. Gran negocio para el sindicato petrolero. Las pipas están haciendo corridas extras para tratar de mitigar el desabasto de gasolina. Gran negocio para el sindicato petrolero. Los piperos, que son todos sindicalizados, están trabajando y cobrando horas extras. Gran negocio, vía sus cuotas, para el sindicato y sus mandamases Romero y Aldana, quienes se dan vida de magnates y cuyos excesos han estado a la luz de todos.

Pemex tiene mil 800 pipas. Las controla el sindicato. No son muchas si pensamos el tamaño del desabasto y la extensión del país. Hay también algunas pipas de empresas privadas pero son las menos. En realidad, en el país hay pocas pipas, por eso no se están dando abasto.

El error central de implementación de la loable intención de acabar con el huachicoleo es el momento en que decidieron hacerlo. Hay dos épocas del año en las que las reservas de combustible están al mínimo porque la gente demanda de manera extraordinaria: Navidad-Año Nuevo y Semana Santa-Pascua. En sitios como la Ciudad de México, Guadalajara, Acapulco, las reservas bajan a solamente medio día de combustible almacenado. Es decir, operan en el límite.

Los nuevos funcionarios no tomaron eso en cuenta y cerraron los ductos en el momento en que más iban a afectar a la ciudadanía. Cuando decidieron encomendar toda distribución del combustible a las pipas se dieron cuenta de que no había suficientes y que la ingeniería de las estaciones de almacenamiento está armada para que se reparta en ductos y pipas por separado, y no es tan sencillo como “mover la manguera” para que llene la pipa en lugar de llenar el ducto.

Quizá el ejemplo más claro es Tuxpan. Hay buques llenos de combustible anclados ahí, pero la terminal no puede recibir de los buques más gasolina y diésel porque no tiene espacio para almacenarlos, porque no ha podido repartir a la misma velocidad de antes.
 

[email protected]
",Quién está feliz con el desabasto de gasolina
