body,title
"
El actor Diego Luna pidió a Morena explicar por qué “de repente”, apenas pasaron las elecciones, el presidente Andrés Manuel López Obrador cambió de postura, de proponer durante campaña el regreso paulatino de los militares a los cuarteles, a una Guardia Nacional como la que plantea ahora.
En el marco de la discusión sobre la Guardia Nacional y auspiciado por la organización Ambulante, la Cámara de Diputados exhibió hoy el documental Hasta los dientes, de Alberto Arnaut.
El filme documenta los hechos ocurridos el 19 de marzo 2010 en el Tecnológico de Monterrey, en el que militares asesinaron a los estudiantes Javier Arredondo y Jorge Antonio Mercado, a los que en principio intentó criminalizar como “sicarios”.
Tras la cinta, con materiales originales en los que se ve cómo actuaron elementos militares, el actor pidió a todos los diputados y senadores ver el documental antes de tomar una decisión sobre la Guardia Nacional. 
Y a los diputados de Morena presentes, la vicecoordinadora Tatiana Clouthier y Paola Hernández, Luna planteó: “yo escuché muchas veces en la campaña sobre regresar a los militares paulatinamente a los cuarteles y de repente cambió la postura, cambió la postura después de que la gran mayoría votó por él y a la fecha no sé por qué, no sé si ustedes lo saben.
¿Cómo fue que cambió y de repente nos escuchamos hoy discutiendo esto?”, expresó el actor, al recordar la frase del presidente, dicha en campaña “no se puede apagar el fuego con el fuego, no se puede enfrentar el mal con el mal, vamos a poner énfasis en la seguridad pública, vamos a integrar esta Guardia Nacional por que no se requiere para ello una reforma constitucional”.
Pidió no esperar a que un algo les pase a los ciudadanos para activarse y tomar una postura.
Ahí, a cinco días de que se discuta en la Cámara de Diputados la creación de la Guardia Nacional, la principal oposición de Morena a un cuerpo y mando militarizado, la vicecoordinadora de la bancada, Tatiana Clouthier, insistió en su postura “el sentido común me dice que no” a la Guardia Nacional.
Pidió a los ciudadanos “perseguir” a sus legisladores y exigir los representen en el Congreso.
Si no los representan, demandó, emitan un voto de castigo en la próxima elección, “ya saben cómo voy a votar yo, si las cosas no cambian” dijo al reiterar su rechazo a la Guardia Nacional con mando, disciplina, e inteligencia militar, como fórmula para enfrentar la inseguridad pública.
“Tiemblo de pensar”, dijo, que a su hija, estudiante hoy del Tecnológico, le pase lo mismo por militarizarse la seguridad pública.
Refirió que no se trata sólo de que el mando sea militar, sino que como Institución que tiene una disciplina castrense, “todo lo del Ejército se tiene que callar” y se ponen en riesgo las libertades al grado de querer prohibir incluso que se grabe en celular (como ocurrió con una testigo del operativo reflejado en el documental) “y eso no viene en ninguna ley…queremos un país de libertades”.
En tanto, la diputada Paola Hernández, ofreció que la bancada de Morena analizará la iniciativa y promoverá capacitación para los integrantes de la Guardia.
En discusión tras la cinta, Lucía Baca, madre de Alfonso Moreno Baca, lamentó que las audiencias sobre la Guardia Nacional no hayan escuchado la voz de las víctimas cuyas experiencias con elementos castrenses en las calles es de desapariciones y muertes.
Pero auguró que ese cuerpo será “pan con lo mismo, más violencia, más desaparecidos”.
El director del documental, Arberto Arnaut, aseguró que es “francamente decepcionante” que se plantee la Guardia Nacional cuando se habló de cesar la violencia y dijo a los legisladores que “se han ganado la animadversión” con la propuesta.
Advirtió que es inadmisible que incluso se piense en dar a la milicia facultades de investigación, cuando hay casos como el del Tecnológico, donde hubo manipulación de pruebas.
La también diputada, pero de Movimiento Ciudadano, Martha Tagle, advirtió que lo que procede es desechar la iniciativa de Ley para la creación de la Guardia Nacional, pues pretender parcharla podría resultar peor aún.
En la discusión, Ernesto López Portillo, Coordinador del programa de seguridad de la Universidad Iberoamericana, reiteró los contras a la propuesta, entre ellos el riesgo de llegar al punto de no retorno, en el que el poder militar supere al poder civil al grado de que sea irreversible.
“La intervención de las Fuerzas Armadas en las calles es la capitulación de la autoridad civil…desde el desgobierno civil emerge la propuesta de militariza la seguridad”, advirtió.
agv
","AMLO cambió ""de repente"" postura sobre Guardia Nacional: Diego Luna"
"Por D. Fuentes y A. Ahedo
El homicidio de dos mujeres perpetrado la noche del martes en la colonia La Providencia, alcaldía Gustavo A. Madero, fue turnado a la PGR debido a que en la casa donde fueron asesinadas se encontró lo que aparentemente es un laboratorio de metanfetaminas.
En un principio la investigación se inició como un presunto robo, pues se dio a conocer que las víctimas eran empresarias, prestamistas y organizaban tandas entre sus vecinos, sin embargo, la presencia de los precursores químicos dio un vuelco al doble homicidio.
“Ese asunto se fue a la PGR porque encontramos metanfetaminas y un laboratorio. Estamos verificando el tema de las niñas porque al parecer se las llevó el papá”, explicó la procuradora Ernestina Godoy.
Las víctimas fueron identificadas como Azucena Patricia, de 51 años y su hija Yesenia Azucena, de 29. El hallazgo lo hizo otra de las hijas de Azucena al acudir al domicilio, pues refirió a las autoridades que durante todo el martes no le contestó ni el celular ni el teléfono de su casa.
La familiar refirió que Azucena Patricia tenía un negocio de refacciones en la calle Artículo 123, en el Centro de la ciudad, y que su hermana tenía otros negocios en Michoacán y que sólo llegó a pasar estos días con su mamá y sus hermanas. 
NO ESCUCHARON NADA. La mujer asesinada era tranquila, llevaba más de 15 años en la zona y su homicidio pasó desapercibido, dijeron sus vecinos.
“No escuchamos nada, sólo hasta ayer que vinieron los peritos y comenzaron a hacer preguntas sobre las mujeres”, dijo.
Los comerciantes y habitantes dijeron que Azucena vendía alitas sobre la calle Constitución de la República los fines de semana y de vez en cuando era apoyada por su hija; sin embargo, desde el doble feminicidio no se ha visto a ninguno de los demás parientes de las víctimas.
Ahora, el domicilio es vigilado por dos policías con armas largas. En la fachada hay un moño negro y ninguna persona atiende a la puerta.
Aunque en un principio se dijo que no había cámaras de seguridad en el domicilio, este medio constató que hay al menos dos que apuntan hacia la puerta y sensores de movimiento que encienden luces al paso de los transeúntes.
",
"Este viernes, el presidente Donald Trump anunció que planea cambios para la visa H-1B, de ocupaciones especializadas.
""Los tenedores de (visas) H-1B en Estados Unidos pueden estar tranquilos de que pronto se vienen cambios que darán tanto simplicidad como certidumbre a su estadía, incluyendo una potencial vía a la ciudadanía"", publicó en Twitter.
“Queremos alentar a personas talentosas y altamente especializadas a aspirar a opciones de carreras en Estados Unidos”, escribió.

H1-B holders in the United States can rest assured that changes are soon coming which will bring both simplicity and certainty to your stay, including a potential path to citizenship. We want to encourage talented and highly skilled people to pursue career options in the U.S.
— Donald J. Trump (@realDonaldTrump) 11 de enero de 2019

Actualmente, se entrega un número limitado de 65,000 visas H-1B por año fiscal. Las empresas estadounidenses usan el programa para contratar temporalmente a extranjeros altamente calificados.
Recomendamos 






Visa H1-B podría conducir a una ciudadanía estadounidense: Trump


El presidente dejó entrever, vía twitter, que la visa H1-B podría conducir eventualmente a una ciudadanía estadounidense 



Éstos deben deben tener amplia experiencia teórica o técnica en campos como la ciencia, ingeniería o programación. El Servicio de Inmigración y Ciudadanía apunta que son elegibles los extranjeros que cumplan con los siguientes requisitos:

El trabajador debe tener un título en Licenciatura o posgrado en una universidad acreditada.
Se da preferencia a los extranjeros que completaron estudios de licenciatura en Estados Unidos.
El postulante debe contar con una “licencia, registro o certificación estatal sin restricciones que le autorice a ejercer plenamente la ocupación de especialidad”.
Debe demostrar su experiencia y especialidad con puestos de alta responsabilidad que haya ocupado.

Las visas H-1B de ocupaciones especializadas tienen vigencia de tres años, pero USCIS puede extenderla por tres años más si el empleador lo solicita. De hecho, en algunos casos han llegado a extenderla más allá de los seis años.
Para que el empleador pueda solicitar una extensión de visa debe presentar el Formulario I-129.
El anuncio de que la visa de ocupaciones especializadas podría conducir, eventualmente, a la ciudadanía ha desatado un debate en redes sociales.
Mientras algunos usuarios celebran la decisión, otros cuestionan que sólo se dé apoyo a las personas promovidas por empresas.
“Si eres inteligente, se te permite entrar, pero si estás huyendo por tu vida acompañado de tus hijos, ¿tienes que quedarte al otro lado del muro imaginario?”, cuestionó el editor Brian Krassenstein a Donald Trump.
En nuestra galería de la parte superior describimos el paso a paso para tramitar la visa H-1B, de ocupaciones especializadas.
No te pierdas 






Estos son los precios de las visas de EU para 2019 


Toma nota del costo, según el tipo de visa americana que vayas a solicitar 



",
"
Texto: Aída Castro SánchezDiseño web: Miguel Ángel Garnica
 

Compara el antes y después deslizando la barra central
(clic aquí para ver más grande)


Este 9 de enero se cumplieron 82 años de la llegada de León Trotsky a México. Contrario a lo que se piensa que detrás de la petición de exilio al presidente Lázaro Cárdenas no sólo está el muralista Diego Rivera, poco se ha reconocido la labor de la escritora mexicana Anita Brenner Duchan (1905-1974).
Radicada en Nueva York, en 1936 la periodista envió un telegrama al pintor a nombre de “el comité americano para la defensa de León Trotsky” y averiguar si el gobierno mexicano lo podía asilar tras su inminente expulsión de Noruega.
El 13 de noviembre de 1933 Brenner entrevistó en secreto al líder revolucionario cuando estaba exiliado en París y después publicó un texto en el periódico The New York Times. Algunas de sus biógrafas comentan que Anita fue detractora de Joseph Stalin y se unió al Comité de John Dewey en defensa de Trosky.
La escritora judía nacida en Aguascalientes el 13 de agosto de 1905, fue registrada como Hana Brenner Duchan. Su padre, Isidoro Brenner emigró a Estados Unidos desde un pueblo de Letonia en 1880, conoció a Paula Duchan con quien se casó y tuvo cinco hijos, posteriormente viajaron a México.
Durante la Revolución la familia Brenner dejó el país varias veces y en definitiva se fueron a vivir a Estados Unidos en 1916, de acuerdo con el libro Anita Brenner. Una escritora judía con México en el corazón, de Marcela López Arellano.
La periodista y corresponsal del diario The New York Times fue una gran promotora del arte mexicano.
En 1923, a los18 años Brenner regresó a México porque en la Universidad de Texas vivió racismo y rechazo. “La universidad fue peor, cuando fui allí, había un letrero en una exclusiva casa de huéspedes que decía: No se permiten judías. Así que hui. Me fui a México, renunciando a una licenciatura”, dijo la escritora, según la extensa investigación de Marcela López Arellano.
“Anita Brenner fue una mujer revolucionaria que desafió los roles tradicionales”, describe la historiadora Alicia Gojman de Backal. Su regreso a México le valió las críticas familiares y así lo comentó en sus cartas: “Todos se lamentaron. Una chica joven sola en un salvaje, inestable e incivilizado país”.
La periodista fue muy amiga de Frida Kahlo, Tina Modotti, José Clemente Orozco, David Alfaro Siqueiros y Diego Rivera. Sus libros y textos impulsaron el arte mexicano posrevolucionario, registró la máxima especialista en la vida y el trabajo de Brenner, Marcela López Arellano.
El exilio de Trotsky en México
El político revolucionario de origen judío Lev Davidovich Bronstein (Ucrania, 1879-México, 140) mejor conocido como León Trotsky, creador del Ejército Rojo y artífice de la Revolución de Octubre en Rusia, se enfrentó a Joseph Stalin y fue expulsado de su país en febrero de 1929. Residió en Turquía, Francia y Noruega antes de llegar a México.
León Trotsky a su llegada a la capital mexicana proveniente de Europa. La imagen fue publicada en EL UNIVERSAL Ilustrado, el 17 de enero de 1937.
La relación de Anita Brenner con los intelectuales mexicanos de la época posrevolucionaria le permitió ser artífice para que Trotsky viviera en nuestro país. En los tres años y siete meses de la estancia del líder soviético no hay registro de que ellos se encontraran en México ya que Brenner vivía en Nueva York y regresó a tierras mexicanas a partir de 1944, después de que lo asesinaron.
En noviembre de 1936, después de recibir el telegrama de Brenner el pintor Diego Rivera y el profesor Octavio Fernández, líder de los trotskistas mexicanos, gestionaron personalmente ante el presidente Lázaro Cárdenas la petición de asilo, según el libro El grito de Trotsky. Ramón Mercader, el hombre que mató al líder revolucionario, de José Ramón Garmabella.
El 7 de diciembre de 1936 nuestro diario publicó la noticia: “El gobierno mexicano le concederá el permiso”. Trotsky pensó que todo formaba parte de un plan para asesinarlo ya que le habían dicho que viajaría en un petrolero y habían planeado el hundimiento del mismo con él abordo, así lo escribió en su libro Los Gángsters de Stalin.
Las gestiones de Brenner, Rivera y Fernández ante el gobierno mexicano fueron exitosas. Trotsky y su esposa Natalia Sedova viajaron a México en el barco petrolero Ruth, que zarpó de Noruega el 9 de diciembre de 1936.
Encuentro de Trotsky y Diego Rivera con los corresponsales extranjeros a su llegada a la casa de Frida Kahlo en Coyoacán.La imagen fue publicada en EL UNIVERSAL Ilustrado, el 17 de enero de 1937.
El 9 de enero de 1937 entró al río Pánuco, en Tampico y los refugiados fueron recibidos por Frida Kahlo, George Novak, secretario del Comité Estadounidense de Defensa de León Trotsky y Mas Shachtman, fundador del movimiento trotskista en Estados Unidos, de acuerdo con las notas publicadas.
Después de hospedarse unas horas en Tampico, el más grande enemigo de Stalin y su esposa llegaron a la capital mexicana en el tren presidencial Hidalgo. El matrimonio Trotsky fue recibido por Diego Rivera en la estación de Lechería y los llevaron a Coyoacán, que a finales de los años treinta era una zona residencial de paisaje rústico al sur de la capital. Ahí se encontraba la Casa Azul, casona ubicada en la calle de Londres, lugar en el que Frida Kahlo nació y murió. Hoy es un museo que lleva el nombre de la pintora mexicana.
El líder político ruso fue acusado por el Tribunal de la Suprema Corte de la Unión Soviética en Moscú de encabezar una banda terrorista dedicada a planear el asesinato de Stalin, entre otras imputaciones. Es por ello que durante su exilio en México, en abril de 1937 dio su testimonio para defenderse ante la Comisión de Investigación dirigida por John Dewey (conocido como el Comité John Dewey).
 El 20 de agosto de 1940 Ramón Mercader logró llegar hasta el despacho de Trotsky y asestarle un golpe en la cabeza con un piolet que traía escondido en su gabardina. El líder rojo murió al día siguiente, a las 07:25 de la noche.
Anita Brenner estaba en el grupo de intelectuales judíos de izquierda de la revista Menorah Journal que mostraron su simpatía por Trotsky. También formó parte de este Comité, de acuerdo con la investigadora Marcela López.
“Estuve involucrada en el famoso Comité… que intentó destapar y hacer pública la mentira que hace que las cosas funcionen tan brutalmente en la Unión Soviética y que fue elegido por Hitler como un “modus operandi” e hizo al mundo entero un daño inmenso…”.
Antes de ser asesinado Trotsky fundó en México la Cuarta Internacional (1938). El 24 de mayo de 1940 sufrió un atentado en su casa ubicada en la calle de Viena, en Coyoacán (hoy es el Museo Casa León Trotsky).
En la imagen la vivienda de Trotsky ubicada en la calle de Viena, donde el pintor David Alfaro Siqueiros, miembro del Partido Comunista, intentó asesinar al marxista el 24 de mayo de 1940, quien se encontraba con su esposa Natalia Sedova y su nieto Esteban Volkov. Hoy ese lugar es parte del Museo Casa León Trotsky.
La persecución contra el enemigo más grande de Stalin culminó con el asesinato del pensador marxista el 21 de agosto de 1940, tras ser atacado por Ramón Mercader quien le asestó un golpe en la cabeza con un piolet (herramienta que utilizan los montañistas para escalar).
El 22 de agosto de 1940, este diario publicó la muerte de uno de los artífices de la Revolución de Octubre en 1917 y compañero de Lennin. Después de más de una década de persecución fue asesinado en México.
Brenner, una pluma incansable
A principios del siglo XX, Anita Brenner vivió un tiempo entre México y Nueva York. Su primer artículo lo escribió a los 19 años para un periódico judío. Era bilingüe, siempre escribió en inglés y para lectores estadounidenses. Entre otros temas, se enfocó a la vida de los judíos en México, a promover a nuestro país como destino turístico en la época de la pos revolución cuando la imagen.
La historiadora de arte Alicia Azuela comenta que el libro Ídolos tras los altares (1929), escrito por Brenner es una obra pionera por ser el primer estudio especializado acerca del “renacimiento artístico mexicano” y por ser la primera vez que este movimiento fue difundido en el extranjero.
Para Carlos Monsiváis, Brenner fue “una personalidad de un tiempo de la vida cultural de México”. “Su escritura nos presenta una relación fascinante entre su pertenencia a la cultura judía y su profundo interés en México, una mujer que nunca se definió como feminista pero que hizo visibles a las mujeres en sus escritos”, afirma Marcela López Arellano.
En 1930 se casó con el médico David Glusker con quien tuvo dos hijos, Peter y Susannah Glusker. Ya casada, terminó sus estudios de doctorado en la Universidad de Columbia en 1931.
En la biografía de su madre, Susannah Glusker señala que en esos años en Nueva York, Anita “se convirtió en una escritora profesional de desbordante energía”. Tan sólo durante la década de los años treinta, ella publicó más de 160 artículos en temas de arte, México, política y la guerra civil española como corresponsal para The New York Times. También hizo libros para niños.
Desde 1944 vivió en México con sus hijos y en 1952 le diagnosticaron cáncer. Entre 1955 y 1972  Anita editó su revista Mexico-This Month para que la leyeran en Estados Unidos. Durante estos años regresó a su ciudad natal, Aguascalientes, para rescatar el rancho de su padre.
En 1958 Anita Brenner celebra el tercer aniversario de su revista Mexico-This Month. (EL UNIVERSAL/15 de abril de 1958).
En 1967 el gobierno mexicano le otorgó el Premio Orden Mexicana del Águila Azteca (distinción para reconocer a los extranjeros por sus servicios humanitarios) que ella rechazó: “¡Habrase visto! ¡Otorgarle el Águila Azteca a una mexicana!”.
De acuerdo con sus biógrafas, los últimos años de su vida los pasó en Aguascalientes donde recuperó el rancho de su padre, abandonado tras la Revolución Mexicana. Se dedicó a cultivar un huerto y árboles frutales.
La escritora judía estadounidense de origen mexicano tuvo un accidente automovilístico cerca del pueblo de Ojuelos, Jalisco, al regresar a la Ciudad de México desde Aguascalientes y murió el 1 de diciembre de 1974.
Días después el crítico literario Antonio Acevedo Escobedo escribió un artículo en EL UNIVERSAL (16 de diciembre) lamentando su partida y destacando su obra. “Voluntariosa, inteligente, sarcástica, amiga a pecho partido, ha muerto de manera trágica Anita Brenner”.
El 14 de septiembre de 2017 el Skirball Cultural Center de Los Ángeles inauguró una exposición en su honor titulada Another Promised Land: Anita Brenner’s Mexico (Otra tierra prometida: el México de Anita Brenner), para mostrar al mundo su legado.
Anita Brenner se salvó de morir de cáncer pero perdió la vida de manera trágica en un accidente automovilístico en 1974. En la imagen parte del texto del escritor Antonio Acevedo, quien lamenta su perdida.
FUENTES:
Las fotos de Anita Brenner fueron tomadas de la página del el Skirball Cultural Center de Los Ángeles.
Archivo y Hemeroteca de EL UNIVERSAL.Anita Brenner. Una escritora judía con México en el corazón, de Marcela López Arellano.Anita Brenner. Una mujer extraordinaria, escrito por su hija la historiadora Susannah Joel Glusker.
Museo Casa de León Trotsky. Guía oficial.Los Gánsters de Stalin, de León Trotsky.https://www.skirball.org/exhibitions/another-promised-land-anita-brenner...https://www.enlacejudio.com/2017/11/28/fil-anita-brenner-una-escritora-j...https://diariojudio.com/comunidad-judia-mexico/anita-brenner-historiador...
 
",La mujer que ayudó a Trotsky a exiliarse en México
"
En un hecho inédito, los mandos del Ejército y de la Marina participan en una audiencia pública ante el Congreso de la Unión sobre la situación de inseguridad que afecta al país, concretamente para abordar el tema de la Guardia Nacional.
Los titulares de las secretarías de la Defensa Nacional, Luis Crescencio Sandoval, y de la Marina Armada, José Rafael Ojeda Durán, se reúnen este viernes con senadores y diputados, en compañía del titular de la Secretaría de Seguridad, Alfonso Durazo y del encargado del despacho de la PGR, Alejandro Gertz Manero.
El coordinador de la bancada del partido Morena en la Cámara de Diputados, Mario Delgado Carrillo destacó el hecho y dijo que el gobierno federal es sensible.
En su intervención, el titular de la Sedena, el general Luis Crescencio Sandoval afirmó que la Constitución reconoce el poder civil de la Guardia Nacional.
“La responsabilidad del empleo de la Guardia Nacional será completamente civil”, indicó.
cg
",Secretarios de Marina y Sedena acuden a audiencia sobre Guardia Nacional
